{
  "case_id": "CT-2026-001",
  "dataset_name": "case_ct_2026_001_ground_truth",
  "dataset_version": "1.0.0",
  "timezone": "America/New_York",
  "narrative_date_local": "2026-03-12",
  "record_count": 42,
  "artifact_counts": {
    "message": 8,
    "call": 4,
    "browser_visit": 6,
    "location_point": 10,
    "photo": 4,
    "app_event": 8,
    "recovered_record": 2
  },
  "records": [
    {
      "artifact_type": "message",
      "source_file": "/data/user/0/com.casetrace.waypoint/databases/waypoint_core.db",
      "record_id": "msg-001",
      "event_time_start": "2026-03-12T12:10:00Z",
      "event_time_end": "2026-03-12T12:10:00Z",
      "actor": "Mira Chen",
      "counterparty": "Jordan Vega",
      "location": null,
      "content_summary": "Asked Jordan to confirm the noon meetup near Harbor Cafe.",
      "raw_ref": "db://files/databases/waypoint_core.db#table=messages&rowid=1",
      "deleted_flag": false,
      "confidence": 0.99,
      "parser_version": "phase0-spec/1.0.0"
    },
    {
      "artifact_type": "message",
      "source_file": "/data/user/0/com.casetrace.waypoint/databases/waypoint_core.db",
      "record_id": "msg-002",
      "event_time_start": "2026-03-12T12:12:00Z",
      "event_time_end": "2026-03-12T12:12:00Z",
      "actor": "Jordan Vega",
      "counterparty": "Mira Chen",
      "location": null,
      "content_summary": "Confirmed arrival via the East Line and said the blue folio would come along.",
      "raw_ref": "db://files/databases/waypoint_core.db#table=messages&rowid=2",
      "deleted_flag": false,
      "confidence": 0.98,
      "parser_version": "phase0-spec/1.0.0"
    },
    {
      "artifact_type": "message",
      "source_file": "/data/user/0/com.casetrace.waypoint/databases/waypoint_core.db",
      "record_id": "msg-003",
      "event_time_start": "2026-03-12T14:42:00Z",
      "event_time_end": "2026-03-12T14:42:00Z",
      "actor": "Riley Brooks",
      "counterparty": "Jordan Vega",
      "location": null,
      "content_summary": "Sent the updated garage code and warned that parking closes at 19:30.",
      "raw_ref": "db://files/databases/waypoint_core.db#table=messages&rowid=3",
      "deleted_flag": false,
      "confidence": 0.98,
      "parser_version": "phase0-spec/1.0.0"
    },
    {
      "artifact_type": "message",
      "source_file": "/data/user/0/com.casetrace.waypoint/databases/waypoint_core.db",
      "record_id": "msg-004",
      "event_time_start": "2026-03-12T14:44:00Z",
      "event_time_end": "2026-03-12T14:44:00Z",
      "actor": "Jordan Vega",
      "counterparty": "Riley Brooks",
      "location": null,
      "content_summary": "Acknowledged the garage note and said the backup stop was Union Transit Hall.",
      "raw_ref": "db://files/databases/waypoint_core.db#table=messages&rowid=4",
      "deleted_flag": false,
      "confidence": 0.97,
      "parser_version": "phase0-spec/1.0.0"
    },
    {
      "artifact_type": "message",
      "source_file": "/data/user/0/com.casetrace.waypoint/databases/waypoint_core.db",
      "record_id": "msg-005",
      "event_time_start": "2026-03-12T16:18:00Z",
      "event_time_end": "2026-03-12T16:18:00Z",
      "actor": "Noah Bennett",
      "counterparty": "Jordan Vega",
      "location": null,
      "content_summary": "Shared an example tickets link and asked Jordan to review the event schedule.",
      "raw_ref": "db://files/databases/waypoint_core.db#table=messages&rowid=5",
      "deleted_flag": false,
      "confidence": 0.98,
      "parser_version": "phase0-spec/1.0.0"
    },
    {
      "artifact_type": "message",
      "source_file": "/data/user/0/com.casetrace.waypoint/databases/waypoint_core.db",
      "record_id": "msg-006",
      "event_time_start": "2026-03-12T16:20:00Z",
      "event_time_end": "2026-03-12T16:20:00Z",
      "actor": "Jordan Vega",
      "counterparty": "Noah Bennett",
      "location": null,
      "content_summary": "Said the venue looked crowded and asked for an alternate coffee stop.",
      "raw_ref": "db://files/databases/waypoint_core.db#table=messages&rowid=6",
      "deleted_flag": false,
      "confidence": 0.97,
      "parser_version": "phase0-spec/1.0.0"
    },
    {
      "artifact_type": "message",
      "source_file": "/data/user/0/com.casetrace.waypoint/databases/waypoint_core.db",
      "record_id": "msg-007",
      "event_time_start": "2026-03-12T21:36:00Z",
      "event_time_end": "2026-03-12T21:36:00Z",
      "actor": "Mira Chen",
      "counterparty": "Jordan Vega",
      "location": null,
      "content_summary": "Asked whether the meetup moved to the Market Square Hotel lobby.",
      "raw_ref": "db://files/databases/waypoint_core.db#table=messages&rowid=7",
      "deleted_flag": false,
      "confidence": 0.98,
      "parser_version": "phase0-spec/1.0.0"
    },
    {
      "artifact_type": "message",
      "source_file": "/data/user/0/com.casetrace.waypoint/databases/waypoint_core.db",
      "record_id": "msg-008",
      "event_time_start": "2026-03-12T21:38:00Z",
      "event_time_end": "2026-03-12T21:38:00Z",
      "actor": "Jordan Vega",
      "counterparty": "Mira Chen",
      "location": null,
      "content_summary": "Confirmed a short stop at Market Square Hotel before heading north.",
      "raw_ref": "db://files/databases/waypoint_core.db#table=messages&rowid=8",
      "deleted_flag": false,
      "confidence": 0.97,
      "parser_version": "phase0-spec/1.0.0"
    },
    {
      "artifact_type": "call",
      "source_file": "/data/user/0/com.casetrace.waypoint/databases/waypoint_core.db",
      "record_id": "call-001",
      "event_time_start": "2026-03-12T13:05:00Z",
      "event_time_end": "2026-03-12T13:09:00Z",
      "actor": "Jordan Vega",
      "counterparty": "Alex Mercer",
      "location": null,
      "content_summary": "Outbound call discussing parking validation near North Pier Garage.",
      "raw_ref": "db://files/databases/waypoint_core.db#table=calls&rowid=21",
      "deleted_flag": false,
      "confidence": 0.97,
      "parser_version": "phase0-spec/1.0.0"
    },
    {
      "artifact_type": "call",
      "source_file": "/data/user/0/com.casetrace.waypoint/databases/waypoint_core.db",
      "record_id": "call-002",
      "event_time_start": "2026-03-12T15:58:00Z",
      "event_time_end": "2026-03-12T16:02:00Z",
      "actor": "Noah Bennett",
      "counterparty": "Jordan Vega",
      "location": null,
      "content_summary": "Inbound call about a schedule change at Harbor Cafe.",
      "raw_ref": "db://files/databases/waypoint_core.db#table=calls&rowid=22",
      "deleted_flag": false,
      "confidence": 0.96,
      "parser_version": "phase0-spec/1.0.0"
    },
    {
      "artifact_type": "call",
      "source_file": "/data/user/0/com.casetrace.waypoint/databases/waypoint_core.db",
      "record_id": "call-003",
      "event_time_start": "2026-03-12T20:48:00Z",
      "event_time_end": "2026-03-12T20:53:00Z",
      "actor": "Jordan Vega",
      "counterparty": "Mira Chen",
      "location": null,
      "content_summary": "Outbound call coordinating the meetup shift toward Riverside Market.",
      "raw_ref": "db://files/databases/waypoint_core.db#table=calls&rowid=23",
      "deleted_flag": false,
      "confidence": 0.97,
      "parser_version": "phase0-spec/1.0.0"
    },
    {
      "artifact_type": "call",
      "source_file": "/data/user/0/com.casetrace.waypoint/databases/waypoint_core.db",
      "record_id": "call-004",
      "event_time_start": "2026-03-12T23:05:00Z",
      "event_time_end": "2026-03-12T23:07:00Z",
      "actor": "Riley Brooks",
      "counterparty": "Jordan Vega",
      "location": null,
      "content_summary": "Inbound call asking whether Jordan cleared the garage before close.",
      "raw_ref": "db://files/databases/waypoint_core.db#table=calls&rowid=24",
      "deleted_flag": false,
      "confidence": 0.95,
      "parser_version": "phase0-spec/1.0.0"
    },
    {
      "artifact_type": "browser_visit",
      "source_file": "/data/user/0/com.casetrace.waypoint/databases/waypoint_web.db",
      "record_id": "web-001",
      "event_time_start": "2026-03-12T12:22:00Z",
      "event_time_end": "2026-03-12T12:22:00Z",
      "actor": "Jordan Vega",
      "counterparty": null,
      "location": null,
      "content_summary": "Visited https://maps.example/transit/east-line for morning route timing.",
      "raw_ref": "db://files/databases/waypoint_web.db#table=browser_history&rowid=1",
      "deleted_flag": false,
      "confidence": 0.96,
      "parser_version": "phase0-spec/1.0.0"
    },
    {
      "artifact_type": "browser_visit",
      "source_file": "/data/user/0/com.casetrace.waypoint/databases/waypoint_web.db",
      "record_id": "web-002",
      "event_time_start": "2026-03-12T13:18:00Z",
      "event_time_end": "2026-03-12T13:18:00Z",
      "actor": "Jordan Vega",
      "counterparty": null,
      "location": null,
      "content_summary": "Visited https://parking.example/north-pier for garage rates and the closing time.",
      "raw_ref": "db://files/databases/waypoint_web.db#table=browser_history&rowid=2",
      "deleted_flag": false,
      "confidence": 0.96,
      "parser_version": "phase0-spec/1.0.0"
    },
    {
      "artifact_type": "browser_visit",
      "source_file": "/data/user/0/com.casetrace.waypoint/databases/waypoint_web.db",
      "record_id": "web-003",
      "event_time_start": "2026-03-12T15:47:00Z",
      "event_time_end": "2026-03-12T15:47:00Z",
      "actor": "Jordan Vega",
      "counterparty": null,
      "location": null,
      "content_summary": "Visited https://harborcafe.example/menu before the noon meetup.",
      "raw_ref": "db://files/databases/waypoint_web.db#table=browser_history&rowid=3",
      "deleted_flag": false,
      "confidence": 0.96,
      "parser_version": "phase0-spec/1.0.0"
    },
    {
      "artifact_type": "browser_visit",
      "source_file": "/data/user/0/com.casetrace.waypoint/databases/waypoint_web.db",
      "record_id": "web-004",